{
  "schema_version": 1,
  "run_id": "20261013-091918-e32cff",
  "requirements": [
    {"id": "REQ-001", "statement": "Users should be able to manage their documents easily.", "type": "functional",
     "priority": "should", "source_quote": "Users should be able to manage their documents easily.", "source_location": "line 1",
     "provenance": "customer_requirement", "kind": "requirement",
     "ambiguity_notes": ["'manage' is undefined (create, edit, delete, organise, upload?)", "'easily' is not measurable", "Which users or roles is not stated", "Which document types is not stated"],
     "related_ids": ["CQ-001", "CQ-002"]},
    {"id": "REQ-002", "statement": "The system must be fast.", "type": "non_functional",
     "priority": "must", "source_quote": "The system must be fast.", "source_location": "line 2",
     "provenance": "customer_requirement", "kind": "requirement",
     "ambiguity_notes": ["'fast' has no target or measure", "Which operations it applies to is not stated", "Load or data volume is not stated"],
     "related_ids": ["CQ-003"]},
    {"id": "REQ-003", "statement": "Documents should be secure.", "type": "non_functional",
     "priority": "should", "source_quote": "Documents should be secure.", "source_location": "line 3",
     "provenance": "customer_requirement", "kind": "requirement",
     "ambiguity_notes": ["'secure' is undefined (access control, encryption, audit, compliance?)", "Threats and regulations are not stated"],
     "related_ids": ["CQ-004"]},
    {"id": "REQ-004", "statement": "Sharing should work like in other tools.", "type": "functional",
     "priority": "should", "source_quote": "Sharing should work like in other tools.", "source_location": "line 4",
     "provenance": "customer_requirement", "kind": "requirement",
     "ambiguity_notes": ["'other tools' not named", "Who can share with whom is not stated", "Permission levels, links and revocation are not stated"],
     "related_ids": ["CQ-005", "CQ-006"]}
  ],
  "assumptions": [],
  "clarifying_questions": [
    {"id": "CQ-001", "question": "What does 'manage' include: for example upload, create, edit, rename, organise into folders, delete, restore?",
     "why_it_matters": "Defines the functional scope of document management.", "blocking": true,
     "related_ids": ["REQ-001"], "consequence_if_unanswered": "Scope of document management cannot be specified; deletion behaviour may be irreversible.", "topic": "scope"},
    {"id": "CQ-002", "question": "Which users or roles manage documents, and can they manage only their own documents or others' too?",
     "why_it_matters": "Roles and permissions determine what each user can do.", "blocking": true,
     "related_ids": ["REQ-001"], "consequence_if_unanswered": "Permissions cannot be specified.", "topic": "roles"},
    {"id": "CQ-003", "question": "What does 'fast' mean: which operations, and what response time under what load?",
     "why_it_matters": "A measurable target is needed to specify and verify the requirement.", "blocking": false,
     "related_ids": ["REQ-002"], "consequence_if_unanswered": "The requirement cannot be tested.", "topic": "performance"},
    {"id": "CQ-004", "question": "What does 'secure' mean here: access control, encryption, audit logging, or specific regulations or standards?",
     "why_it_matters": "Security needs drive design, data handling and possible legal obligations.", "blocking": true,
     "related_ids": ["REQ-003"], "consequence_if_unanswered": "Security scope and compliance obligations remain unknown.", "topic": "security"},
    {"id": "CQ-005", "question": "Which other tools should sharing resemble, and which of their sharing behaviours do you want?",
     "why_it_matters": "'Like other tools' is not a specification.", "blocking": true,
     "related_ids": ["REQ-004"], "consequence_if_unanswered": "Sharing behaviour cannot be specified.", "topic": "sharing"},
    {"id": "CQ-006", "question": "Who can share documents, with whom (internal users, external people, public link), and with what permission levels?",
     "why_it_matters": "Sharing affects access control and data exposure.", "blocking": true,
     "related_ids": ["REQ-004", "REQ-003"], "consequence_if_unanswered": "Sharing permissions cannot be specified and documents may be over-exposed.", "topic": "permissions"}
  ],
  "conflicts": [],
  "proposed_status_changes": [
    {"type": "add_issue", "item_id": "REQ-001", "issue": "unknown", "reason": "'manage' and 'easily' are undefined; roles not stated."},
    {"type": "add_issue", "item_id": "REQ-002", "issue": "unknown", "reason": "No measurable meaning of 'fast'."},
    {"type": "add_issue", "item_id": "REQ-003", "issue": "unknown", "reason": "'secure' is undefined."},
    {"type": "add_issue", "item_id": "REQ-004", "issue": "unknown", "reason": "Reference tools and sharing rules are not stated."}
  ]
}
